[INFO] Scanning for projects...
[INFO] 
[INFO] --------------------< com.oriontek:customerservice >--------------------
[INFO] Building customerservice 0.0.1-SNAPSHOT
[INFO]   from pom.xml
[INFO] --------------------------------[ jar ]---------------------------------
[INFO] 
[INFO] --- clean:3.5.0:clean (default-clean) @ customerservice ---
[INFO] Deleting C:\Users\smedina\Documents\dev\repo\smrsoft\customerservice\target
[INFO] 
[INFO] --- resources:3.3.1:resources (default-resources) @ customerservice ---
[INFO] Copying 3 resources from src\main\resources to target\classes
[INFO] Copying 1 resource from src\main\resources to target\classes
[INFO] 
[INFO] --- compiler:3.14.1:compile (default-compile) @ customerservice ---
[INFO] Recompiling the module because of changed source code.
[INFO] Compiling 4 source files with javac [debug parameters release 21] to target\classes
[INFO] 
[INFO] --- resources:3.3.1:testResources (default-testResources) @ customerservice ---
[INFO] skip non existing resourceDirectory C:\Users\smedina\Documents\dev\repo\smrsoft\customerservice\src\test\resources
[INFO] 
[INFO] --- compiler:3.14.1:testCompile (default-testCompile) @ customerservice ---
[INFO] Recompiling the module because of changed dependency.
[INFO] Compiling 1 source file with javac [debug parameters release 21] to target\test-classes
[INFO] 
[INFO] --- surefire:3.5.4:test (default-test) @ customerservice ---
[INFO] Using auto detected provider org.apache.maven.surefire.junitplatform.JUnitPlatformProvider
[INFO] 
[INFO] -------------------------------------------------------
[INFO]  T E S T S
[INFO] -------------------------------------------------------
[INFO] Running com.oriontek.customerservice.CustomerserviceApplicationTests
16:45:32.456 [main] INFO org.springframework.test.context.support.AnnotationConfigContextLoaderUtils -- Could not detect default configuration classes for test class [com.oriontek.customerservice.CustomerserviceApplicationTests]: CustomerserviceApplicationTests does not declare any static, non-private, non-final, nested classes annotated with @Configuration.
16:45:32.753 [main] INFO org.springframework.boot.test.context.SpringBootTestContextBootstrapper -- Found @SpringBootConfiguration com.oriontek.customerservice.CustomerserviceApplication for test class com.oriontek.customerservice.CustomerserviceApplicationTests
16:45:33.416 [main] INFO org.springframework.boot.devtools.restart.RestartApplicationListener -- Restart disabled due to context in which it is running

  .   ____          _            __ _ _
 /\\ / ___'_ __ _ _(_)_ __  __ _ \ \ \ \
( ( )\___ | '_ | '_| | '_ \/ _` | \ \ \ \
 \\/  ___)| |_)| | | | | || (_| |  ) ) ) )
  '  |____| .__|_| |_|_| |_\__, | / / / /
 =========|_|==============|___/=/_/_/_/

 :: Spring Boot ::                (v4.0.0)

2025-12-15T16:45:34.134-04:00  INFO 9556 --- [customerservice] [           main] c.o.c.CustomerserviceApplicationTests    : Starting CustomerserviceApplicationTests using Java 24.0.2 with PID 9556 (started by smedina in C:\Users\smedina\Documents\dev\repo\smrsoft\customerservice)
2025-12-15T16:45:34.145-04:00  INFO 9556 --- [customerservice] [           main] c.o.c.CustomerserviceApplicationTests    : No active profile set, falling back to 1 default profile: "default"
2025-12-15T16:45:36.275-04:00  INFO 9556 --- [customerservice] [           main] .s.d.r.c.RepositoryConfigurationDelegate : Bootstrapping Spring Data JPA repositories in DEFAULT mode.
2025-12-15T16:45:36.328-04:00  INFO 9556 --- [customerservice] [           main] .s.d.r.c.RepositoryConfigurationDelegate : Finished Spring Data repository scanning in 29 ms. Found 0 JPA repository interfaces.
2025-12-15T16:45:38.439-04:00  INFO 9556 --- [customerservice] [           main] com.zaxxer.hikari.HikariDataSource       : HikariPool-1 - Starting...
2025-12-15T16:45:38.901-04:00  INFO 9556 --- [customerservice] [           main] com.zaxxer.hikari.pool.HikariPool        : HikariPool-1 - Added connection conn0: url=jdbc:h2:mem:51165496-533a-4fb4-b62b-8e6e4f6b629d user=SA
2025-12-15T16:45:38.903-04:00  INFO 9556 --- [customerservice] [           main] com.zaxxer.hikari.HikariDataSource       : HikariPool-1 - Start completed.
2025-12-15T16:45:38.978-04:00  INFO 9556 --- [customerservice] [           main] org.flywaydb.core.FlywayExecutor         : Database: jdbc:h2:mem:51165496-533a-4fb4-b62b-8e6e4f6b629d (H2 2.4)
2025-12-15T16:45:38.993-04:00  WARN 9556 --- [customerservice] [           main] o.f.c.internal.database.base.Database    : Using H2 2.4.240 which is newer than the version Flyway has been verified with. The latest verified version of H2 is 2.3.232.
2025-12-15T16:45:39.046-04:00  INFO 9556 --- [customerservice] [           main] o.f.c.i.s.JdbcTableSchemaHistory         : Schema history table "PUBLIC"."flyway_schema_history" does not exist yet
2025-12-15T16:45:39.051-04:00  INFO 9556 --- [customerservice] [           main] o.f.core.internal.command.DbValidate     : Successfully validated 1 migration (execution time 00:00.028s)
2025-12-15T16:45:39.063-04:00  INFO 9556 --- [customerservice] [           main] o.f.c.i.s.JdbcTableSchemaHistory         : Creating Schema History table "PUBLIC"."flyway_schema_history" ...
2025-12-15T16:45:39.124-04:00  INFO 9556 --- [customerservice] [           main] o.f.core.internal.command.DbMigrate      : Current version of schema "PUBLIC": << Empty Schema >>
2025-12-15T16:45:39.158-04:00  INFO 9556 --- [customerservice] [           main] o.f.core.internal.command.DbMigrate      : Migrating schema "PUBLIC" to version "1 - 1 initial schema"
2025-12-15T16:45:39.216-04:00 ERROR 9556 --- [customerservice] [           main] o.f.core.internal.command.DbMigrate      : Migration of schema "PUBLIC" to version "1 - 1 initial schema" failed! Please restore backups and roll back database and code!
2025-12-15T16:45:39.230-04:00  WARN 9556 --- [customerservice] [           main] o.s.w.c.s.GenericWebApplicationContext   : Exception encountered during context initialization - cancelling refresh attempt: org.springframework.beans.factory.BeanCreationException: Error creating bean with name 'entityManagerFactory' defined in class path resource [org/springframework/boot/hibernate/autoconfigure/HibernateJpaConfiguration.class]: Failed to initialize dependency 'flywayInitializer' of LoadTimeWeaverAware bean 'entityManagerFactory': Error creating bean with name 'flywayInitializer' defined in class path resource [org/springframework/boot/flyway/autoconfigure/FlywayAutoConfiguration$FlywayConfiguration.class]: Failed to execute script V1__1_initial_schema.sql
-------------------------------------------------
SQL State  : 42001
Error Code : 42001
Message    : Syntax error in SQL statement "CREATE [*]EXTENSION IF NOT EXISTS ""uuid-ossp"""; expected "OR REPLACE, FORCE, VIEW, MATERIALIZED, ALIAS, SEQUENCE, USER, TRIGGER, ROLE, SCHEMA, CONSTANT, DOMAIN, TYPE, AGGREGATE, LINKED, MEMORY, CACHED, LOCAL TEMPORARY, GLOBAL TEMPORARY, TEMPORARY, TABLE, SYNONYM, UNIQUE, SPATIAL, INDEX"; SQL statement:
CREATE EXTENSION IF NOT EXISTS "uuid-ossp" [42001-240]
Location   : db/migration/V1__1_initial_schema.sql (C:\Users\smedina\Documents\dev\repo\smrsoft\customerservice\target\classes\db\migration\V1__1_initial_schema.sql)
Line       : 3
Statement  : Run Flyway with -X option to see the actual statement causing the problem

2025-12-15T16:45:39.231-04:00  INFO 9556 --- [customerservice] [           main] com.zaxxer.hikari.HikariDataSource       : HikariPool-1 - Shutdown initiated...
2025-12-15T16:45:39.248-04:00  INFO 9556 --- [customerservice] [           main] com.zaxxer.hikari.HikariDataSource       : HikariPool-1 - Shutdown completed.
2025-12-15T16:45:39.292-04:00  INFO 9556 --- [customerservice] [           main] .s.b.a.l.ConditionEvaluationReportLogger : 

Error starting ApplicationContext. To display the condition evaluation report re-run your application with 'debug' enabled.
2025-12-15T16:45:39.339-04:00 ERROR 9556 --- [customerservice] [           main] o.s.boot.SpringApplication               : Application run failed

org.springframework.beans.factory.BeanCreationException: Error creating bean with name 'entityManagerFactory' defined in class path resource [org/springframework/boot/hibernate/autoconfigure/HibernateJpaConfiguration.class]: Failed to initialize dependency 'flywayInitializer' of LoadTimeWeaverAware bean 'entityManagerFactory': Error creating bean with name 'flywayInitializer' defined in class path resource [org/springframework/boot/flyway/autoconfigure/FlywayAutoConfiguration$FlywayConfiguration.class]: Failed to execute script V1__1_initial_schema.sql
-------------------------------------------------
SQL State  : 42001
Error Code : 42001
Message    : Syntax error in SQL statement "CREATE [*]EXTENSION IF NOT EXISTS ""uuid-ossp"""; expected "OR REPLACE, FORCE, VIEW, MATERIALIZED, ALIAS, SEQUENCE, USER, TRIGGER, ROLE, SCHEMA, CONSTANT, DOMAIN, TYPE, AGGREGATE, LINKED, MEMORY, CACHED, LOCAL TEMPORARY, GLOBAL TEMPORARY, TEMPORARY, TABLE, SYNONYM, UNIQUE, SPATIAL, INDEX"; SQL statement:
CREATE EXTENSION IF NOT EXISTS "uuid-ossp" [42001-240]
Location   : db/migration/V1__1_initial_schema.sql (C:\Users\smedina\Documents\dev\repo\smrsoft\customerservice\target\classes\db\migration\V1__1_initial_schema.sql)
Line       : 3
Statement  : Run Flyway with -X option to see the actual statement causing the problem

	at org.springframework.beans.factory.support.AbstractBeanFactory.doGetBean(AbstractBeanFactory.java:322) ~[spring-beans-7.0.1.jar:7.0.1]
	at org.springframework.beans.factory.support.AbstractBeanFactory.getBean(AbstractBeanFactory.java:201) ~[spring-beans-7.0.1.jar:7.0.1]
	at org.springframework.context.support.AbstractApplicationContext.finishBeanFactoryInitialization(AbstractApplicationContext.java:966) ~[spring-context-7.0.1.jar:7.0.1]
	at org.springframework.context.support.AbstractApplicationContext.refresh(AbstractApplicationContext.java:620) ~[spring-context-7.0.1.jar:7.0.1]
	at org.springframework.boot.SpringApplication.refresh(SpringApplication.java:765) ~[spring-boot-4.0.0.jar:4.0.0]
	at org.springframework.boot.SpringApplication.refreshContext(SpringApplication.java:454) ~[spring-boot-4.0.0.jar:4.0.0]
	at org.springframework.boot.SpringApplication.run(SpringApplication.java:321) ~[spring-boot-4.0.0.jar:4.0.0]
	at org.springframework.boot.test.context.SpringBootContextLoader.lambda$loadContext$2(SpringBootContextLoader.java:148) ~[spring-boot-test-4.0.0.jar:4.0.0]
	at org.springframework.util.function.ThrowingSupplier.get(ThrowingSupplier.java:58) ~[spring-core-7.0.1.jar:7.0.1]
	at org.springframework.util.function.ThrowingSupplier.get(ThrowingSupplier.java:46) ~[spring-core-7.0.1.jar:7.0.1]
	at org.springframework.boot.SpringApplication.withHook(SpringApplication.java:1474) ~[spring-boot-4.0.0.jar:4.0.0]
	at org.springframework.boot.test.context.SpringBootContextLoader$ContextLoaderHook.run(SpringBootContextLoader.java:573) ~[spring-boot-test-4.0.0.jar:4.0.0]
	at org.springframework.boot.test.context.SpringBootContextLoader.loadContext(SpringBootContextLoader.java:148) ~[spring-boot-test-4.0.0.jar:4.0.0]
	at org.springframework.boot.test.context.SpringBootContextLoader.loadContext(SpringBootContextLoader.java:114) ~[spring-boot-test-4.0.0.jar:4.0.0]
	at org.springframework.test.context.cache.DefaultCacheAwareContextLoaderDelegate.loadContextInternal(DefaultCacheAwareContextLoaderDelegate.java:247) ~[spring-test-7.0.1.jar:7.0.1]
	at org.springframework.test.context.cache.DefaultCacheAwareContextLoaderDelegate.lambda$loadContext$0(DefaultCacheAwareContextLoaderDelegate.java:167) ~[spring-test-7.0.1.jar:7.0.1]
	at org.springframework.test.context.cache.DefaultContextCache.put(DefaultContextCache.java:172) ~[spring-test-7.0.1.jar:7.0.1]
	at org.springframework.test.context.cache.DefaultCacheAwareContextLoaderDelegate.loadContext(DefaultCacheAwareContextLoaderDelegate.java:160) ~[spring-test-7.0.1.jar:7.0.1]
	at org.springframework.test.context.support.DefaultTestContext.getApplicationContext(DefaultTestContext.java:128) ~[spring-test-7.0.1.jar:7.0.1]
	at org.springframework.test.context.web.ServletTestExecutionListener.setUpRequestContextIfNecessary(ServletTestExecutionListener.java:200) ~[spring-test-7.0.1.jar:7.0.1]
	at org.springframework.test.context.web.ServletTestExecutionListener.prepareTestInstance(ServletTestExecutionListener.java:139) ~[spring-test-7.0.1.jar:7.0.1]
	at org.springframework.test.context.TestContextManager.prepareTestInstance(TestContextManager.java:260) ~[spring-test-7.0.1.jar:7.0.1]
	at org.springframework.test.context.junit.jupiter.SpringExtension.postProcessTestInstance(SpringExtension.java:203) ~[spring-test-7.0.1.jar:7.0.1]
	at org.junit.jupiter.engine.descriptor.ClassBasedTestDescriptor.lambda$invokeTestInstancePostProcessors$1(ClassBasedTestDescriptor.java:423) ~[junit-jupiter-engine-6.0.1.jar:6.0.1]
	at org.junit.jupiter.engine.descriptor.ClassBasedTestDescriptor.executeAndMaskThrowable(ClassBasedTestDescriptor.java:428) ~[junit-jupiter-engine-6.0.1.jar:6.0.1]
	at org.junit.jupiter.engine.descriptor.ClassBasedTestDescriptor.lambda$invokeTestInstancePostProcessors$0(ClassBasedTestDescriptor.java:422) ~[junit-jupiter-engine-6.0.1.jar:6.0.1]
	at java.base/java.util.stream.ForEachOps$ForEachOp$OfRef.accept(ForEachOps.java:186) ~[na:na]
	at java.base/java.util.stream.ReferencePipeline$3$1.accept(ReferencePipeline.java:215) ~[na:na]
	at java.base/java.util.stream.ReferencePipeline$2$1.accept(ReferencePipeline.java:197) ~[na:na]
	at java.base/java.util.stream.ReferencePipeline$3$1.accept(ReferencePipeline.java:215) ~[na:na]
	at java.base/java.util.ArrayList$ArrayListSpliterator.forEachRemaining(ArrayList.java:1716) ~[na:na]
	at java.base/java.util.stream.AbstractPipeline.copyInto(AbstractPipeline.java:570) ~[na:na]
	at java.base/java.util.stream.AbstractPipeline.wrapAndCopyInto(AbstractPipeline.java:560) ~[na:na]
	at java.base/java.util.stream.ForEachOps$ForEachOp.evaluateSequential(ForEachOps.java:153) ~[na:na]
	at java.base/java.util.stream.ForEachOps$ForEachOp$OfRef.evaluateSequential(ForEachOps.java:176) ~[na:na]
	at java.base/java.util.stream.AbstractPipeline.evaluate(AbstractPipeline.java:265) ~[na:na]
	at java.base/java.util.stream.ReferencePipeline.forEach(ReferencePipeline.java:636) ~[na:na]
	at org.junit.jupiter.engine.descriptor.ClassBasedTestDescriptor.invokeTestInstancePostProcessors(ClassBasedTestDescriptor.java:422) ~[junit-jupiter-engine-6.0.1.jar:6.0.1]
	at org.junit.jupiter.engine.descriptor.ClassBasedTestDescriptor.lambda$instantiateAndPostProcessTestInstance$0(ClassBasedTestDescriptor.java:334) ~[junit-jupiter-engine-6.0.1.jar:6.0.1]
	at org.junit.platform.engine.support.hierarchical.ThrowableCollector.execute(ThrowableCollector.java:74) ~[junit-platform-engine-6.0.1.jar:6.0.1]
	at org.junit.jupiter.engine.descriptor.ClassBasedTestDescriptor.instantiateAndPostProcessTestInstance(ClassBasedTestDescriptor.java:333) ~[junit-jupiter-engine-6.0.1.jar:6.0.1]
	at org.junit.jupiter.engine.descriptor.ClassBasedTestDescriptor.lambda$testInstancesProvider$1(ClassBasedTestDescriptor.java:322) ~[junit-jupiter-engine-6.0.1.jar:6.0.1]
	at java.base/java.util.Optional.orElseGet(Optional.java:364) ~[na:na]
	at org.junit.jupiter.engine.descriptor.ClassBasedTestDescriptor.lambda$testInstancesProvider$0(ClassBasedTestDescriptor.java:321) ~[junit-jupiter-engine-6.0.1.jar:6.0.1]
	at org.junit.jupiter.engine.execution.TestInstancesProvider.getTestInstances(TestInstancesProvider.java:27) ~[junit-jupiter-engine-6.0.1.jar:6.0.1]
	at org.junit.jupiter.engine.descriptor.TestMethodTestDescriptor.lambda$prepare$0(TestMethodTestDescriptor.java:127) ~[junit-jupiter-engine-6.0.1.jar:6.0.1]
	at org.junit.platform.engine.support.hierarchical.ThrowableCollector.execute(ThrowableCollector.java:74) ~[junit-platform-engine-6.0.1.jar:6.0.1]
	at org.junit.jupiter.engine.descriptor.TestMethodTestDescriptor.prepare(TestMethodTestDescriptor.java:126) ~[junit-jupiter-engine-6.0.1.jar:6.0.1]
	at org.junit.jupiter.engine.descriptor.TestMethodTestDescriptor.prepare(TestMethodTestDescriptor.java:70) ~[junit-jupiter-engine-6.0.1.jar:6.0.1]
	at org.junit.platform.engine.support.hierarchical.NodeTestTask.lambda$prepare$0(NodeTestTask.java:144) ~[junit-platform-engine-6.0.1.jar:6.0.1]
	at org.junit.platform.engine.support.hierarchical.ThrowableCollector.execute(ThrowableCollector.java:74) ~[junit-platform-engine-6.0.1.jar:6.0.1]
	at org.junit.platform.engine.support.hierarchical.NodeTestTask.prepare(NodeTestTask.java:144) ~[junit-platform-engine-6.0.1.jar:6.0.1]
	at org.junit.platform.engine.support.hierarchical.NodeTestTask.execute(NodeTestTask.java:110) ~[junit-platform-engine-6.0.1.jar:6.0.1]
	at java.base/java.util.ArrayList.forEach(ArrayList.java:1604) ~[na:na]
	at org.junit.platform.engine.support.hierarchical.SameThreadHierarchicalTestExecutorService.invokeAll(SameThreadHierarchicalTestExecutorService.java:42) ~[junit-platform-engine-6.0.1.jar:6.0.1]
	at org.junit.platform.engine.support.hierarchical.NodeTestTask.lambda$executeRecursively$2(NodeTestTask.java:180) ~[junit-platform-engine-6.0.1.jar:6.0.1]
	at org.junit.platform.engine.support.hierarchical.ThrowableCollector.execute(ThrowableCollector.java:74) ~[junit-platform-engine-6.0.1.jar:6.0.1]
	at org.junit.platform.engine.support.hierarchical.NodeTestTask.lambda$executeRecursively$1(NodeTestTask.java:166) ~[junit-platform-engine-6.0.1.jar:6.0.1]
	at org.junit.platform.engine.support.hierarchical.Node.around(Node.java:138) ~[junit-platform-engine-6.0.1.jar:6.0.1]
	at org.junit.platform.engine.support.hierarchical.NodeTestTask.lambda$executeRecursively$0(NodeTestTask.java:164) ~[junit-platform-engine-6.0.1.jar:6.0.1]
	at org.junit.platform.engine.support.hierarchical.ThrowableCollector.execute(ThrowableCollector.java:74) ~[junit-platform-engine-6.0.1.jar:6.0.1]
	at org.junit.platform.engine.support.hierarchical.NodeTestTask.executeRecursively(NodeTestTask.java:163) ~[junit-platform-engine-6.0.1.jar:6.0.1]
	at org.junit.platform.engine.support.hierarchical.NodeTestTask.execute(NodeTestTask.java:116) ~[junit-platform-engine-6.0.1.jar:6.0.1]
	at java.base/java.util.ArrayList.forEach(ArrayList.java:1604) ~[na:na]
	at org.junit.platform.engine.support.hierarchical.SameThreadHierarchicalTestExecutorService.invokeAll(SameThreadHierarchicalTestExecutorService.java:42) ~[junit-platform-engine-6.0.1.jar:6.0.1]
	at org.junit.platform.engine.support.hierarchical.NodeTestTask.lambda$executeRecursively$2(NodeTestTask.java:180) ~[junit-platform-engine-6.0.1.jar:6.0.1]
	at org.junit.platform.engine.support.hierarchical.ThrowableCollector.execute(ThrowableCollector.java:74) ~[junit-platform-engine-6.0.1.jar:6.0.1]
	at org.junit.platform.engine.support.hierarchical.NodeTestTask.lambda$executeRecursively$1(NodeTestTask.java:166) ~[junit-platform-engine-6.0.1.jar:6.0.1]
	at org.junit.platform.engine.support.hierarchical.Node.around(Node.java:138) ~[junit-platform-engine-6.0.1.jar:6.0.1]
	at org.junit.platform.engine.support.hierarchical.NodeTestTask.lambda$executeRecursively$0(NodeTestTask.java:164) ~[junit-platform-engine-6.0.1.jar:6.0.1]
	at org.junit.platform.engine.support.hierarchical.ThrowableCollector.execute(ThrowableCollector.java:74) ~[junit-platform-engine-6.0.1.jar:6.0.1]
	at org.junit.platform.engine.support.hierarchical.NodeTestTask.executeRecursively(NodeTestTask.java:163) ~[junit-platform-engine-6.0.1.jar:6.0.1]
	at org.junit.platform.engine.support.hierarchical.NodeTestTask.execute(NodeTestTask.java:116) ~[junit-platform-engine-6.0.1.jar:6.0.1]
	at org.junit.platform.engine.support.hierarchical.SameThreadHierarchicalTestExecutorService.submit(SameThreadHierarchicalTestExecutorService.java:36) ~[junit-platform-engine-6.0.1.jar:6.0.1]
	at org.junit.platform.engine.support.hierarchical.HierarchicalTestExecutor.execute(HierarchicalTestExecutor.java:52) ~[junit-platform-engine-6.0.1.jar:6.0.1]
	at org.junit.platform.engine.support.hierarchical.HierarchicalTestEngine.execute(HierarchicalTestEngine.java:58) ~[junit-platform-engine-6.0.1.jar:6.0.1]
	at org.junit.platform.launcher.core.EngineExecutionOrchestrator.executeEngine(EngineExecutionOrchestrator.java:246) ~[junit-platform-launcher-6.0.1.jar:6.0.1]
	at org.junit.platform.launcher.core.EngineExecutionOrchestrator.failOrExecuteEngine(EngineExecutionOrchestrator.java:218) ~[junit-platform-launcher-6.0.1.jar:6.0.1]
	at org.junit.platform.launcher.core.EngineExecutionOrchestrator.execute(EngineExecutionOrchestrator.java:179) ~[junit-platform-launcher-6.0.1.jar:6.0.1]
	at org.junit.platform.launcher.core.EngineExecutionOrchestrator.execute(EngineExecutionOrchestrator.java:108) ~[junit-platform-launcher-6.0.1.jar:6.0.1]
	at org.junit.platform.launcher.core.EngineExecutionOrchestrator.lambda$execute$0(EngineExecutionOrchestrator.java:66) ~[junit-platform-launcher-6.0.1.jar:6.0.1]
	at org.junit.platform.launcher.core.EngineExecutionOrchestrator.withInterceptedStreams(EngineExecutionOrchestrator.java:157) ~[junit-platform-launcher-6.0.1.jar:6.0.1]
	at org.junit.platform.launcher.core.EngineExecutionOrchestrator.execute(EngineExecutionOrchestrator.java:65) ~[junit-platform-launcher-6.0.1.jar:6.0.1]
	at org.junit.platform.launcher.core.DefaultLauncher.execute(DefaultLauncher.java:125) ~[junit-platform-launcher-6.0.1.jar:6.0.1]
	at org.junit.platform.launcher.core.DefaultLauncher.execute(DefaultLauncher.java:114) ~[junit-platform-launcher-6.0.1.jar:6.0.1]
	at org.junit.platform.launcher.core.DelegatingLauncher.execute(DelegatingLauncher.java:58) ~[junit-platform-launcher-6.0.1.jar:6.0.1]
	at org.junit.platform.launcher.core.InterceptingLauncher.lambda$execute$2(InterceptingLauncher.java:57) ~[junit-platform-launcher-6.0.1.jar:6.0.1]
	at org.junit.platform.launcher.core.ClasspathAlignmentCheckingLauncherInterceptor.intercept(ClasspathAlignmentCheckingLauncherInterceptor.java:25) ~[junit-platform-launcher-6.0.1.jar:6.0.1]
	at org.junit.platform.launcher.core.InterceptingLauncher.execute(InterceptingLauncher.java:56) ~[junit-platform-launcher-6.0.1.jar:6.0.1]
	at org.junit.platform.launcher.core.DelegatingLauncher.execute(DelegatingLauncher.java:58) ~[junit-platform-launcher-6.0.1.jar:6.0.1]
	at java.base/jdk.internal.reflect.DirectMethodHandleAccessor.invoke(DirectMethodHandleAccessor.java:104) ~[na:na]
	at java.base/java.lang.reflect.Method.invoke(Method.java:565) ~[na:na]
	at org.apache.maven.surefire.api.util.ReflectionUtils.invokeMethodWithArray(ReflectionUtils.java:125) ~[surefire-api-3.5.4.jar:3.5.4]
	at org.apache.maven.surefire.junitplatform.LauncherAdapter.executeWithCancellationToken(LauncherAdapter.java:68) ~[surefire-junit-platform-3.5.4.jar:3.5.4]
	at org.apache.maven.surefire.junitplatform.LauncherAdapter.execute(LauncherAdapter.java:54) ~[surefire-junit-platform-3.5.4.jar:3.5.4]
	at org.apache.maven.surefire.junitplatform.JUnitPlatformProvider.execute(JUnitPlatformProvider.java:203) ~[surefire-junit-platform-3.5.4.jar:3.5.4]
	at org.apache.maven.surefire.junitplatform.JUnitPlatformProvider.invokeAllTests(JUnitPlatformProvider.java:168) ~[surefire-junit-platform-3.5.4.jar:3.5.4]
	at org.apache.maven.surefire.junitplatform.JUnitPlatformProvider.invoke(JUnitPlatformProvider.java:136) ~[surefire-junit-platform-3.5.4.jar:3.5.4]
	at org.apache.maven.surefire.booter.ForkedBooter.runSuitesInProcess(ForkedBooter.java:385) ~[surefire-booter-3.5.4.jar:3.5.4]
	at org.apache.maven.surefire.booter.ForkedBooter.execute(ForkedBooter.java:162) ~[surefire-booter-3.5.4.jar:3.5.4]
	at org.apache.maven.surefire.booter.ForkedBooter.run(ForkedBooter.java:507) ~[surefire-booter-3.5.4.jar:3.5.4]
	at org.apache.maven.surefire.booter.ForkedBooter.main(ForkedBooter.java:495) ~[surefire-booter-3.5.4.jar:3.5.4]
Caused by: org.springframework.beans.factory.BeanCreationException: Error creating bean with name 'flywayInitializer' defined in class path resource [org/springframework/boot/flyway/autoconfigure/FlywayAutoConfiguration$FlywayConfiguration.class]: Failed to execute script V1__1_initial_schema.sql
-------------------------------------------------
SQL State  : 42001
Error Code : 42001
Message    : Syntax error in SQL statement "CREATE [*]EXTENSION IF NOT EXISTS ""uuid-ossp"""; expected "OR REPLACE, FORCE, VIEW, MATERIALIZED, ALIAS, SEQUENCE, USER, TRIGGER, ROLE, SCHEMA, CONSTANT, DOMAIN, TYPE, AGGREGATE, LINKED, MEMORY, CACHED, LOCAL TEMPORARY, GLOBAL TEMPORARY, TEMPORARY, TABLE, SYNONYM, UNIQUE, SPATIAL, INDEX"; SQL statement:
CREATE EXTENSION IF NOT EXISTS "uuid-ossp" [42001-240]
Location   : db/migration/V1__1_initial_schema.sql (C:\Users\smedina\Documents\dev\repo\smrsoft\customerservice\target\classes\db\migration\V1__1_initial_schema.sql)
Line       : 3
Statement  : Run Flyway with -X option to see the actual statement causing the problem

	at org.springframework.beans.factory.support.AbstractAutowireCapableBeanFactory.initializeBean(AbstractAutowireCapableBeanFactory.java:1817) ~[spring-beans-7.0.1.jar:7.0.1]
	at org.springframework.beans.factory.support.AbstractAutowireCapableBeanFactory.doCreateBean(AbstractAutowireCapableBeanFactory.java:603) ~[spring-beans-7.0.1.jar:7.0.1]
	at org.springframework.beans.factory.support.AbstractAutowireCapableBeanFactory.createBean(AbstractAutowireCapableBeanFactory.java:525) ~[spring-beans-7.0.1.jar:7.0.1]
	at org.springframework.beans.factory.support.AbstractBeanFactory.lambda$doGetBean$0(AbstractBeanFactory.java:333) ~[spring-beans-7.0.1.jar:7.0.1]
	at org.springframework.beans.factory.support.DefaultSingletonBeanRegistry.getSingleton(DefaultSingletonBeanRegistry.java:371) ~[spring-beans-7.0.1.jar:7.0.1]
	at org.springframework.beans.factory.support.AbstractBeanFactory.doGetBean(AbstractBeanFactory.java:331) ~[spring-beans-7.0.1.jar:7.0.1]
	at org.springframework.beans.factory.support.AbstractBeanFactory.getBean(AbstractBeanFactory.java:196) ~[spring-beans-7.0.1.jar:7.0.1]
	at org.springframework.beans.factory.support.AbstractBeanFactory.doGetBean(AbstractBeanFactory.java:309) ~[spring-beans-7.0.1.jar:7.0.1]
	... 101 common frames omitted
Caused by: org.flywaydb.core.internal.exception.FlywayMigrateException: Failed to execute script V1__1_initial_schema.sql
-------------------------------------------------
SQL State  : 42001
Error Code : 42001
Message    : Syntax error in SQL statement "CREATE [*]EXTENSION IF NOT EXISTS ""uuid-ossp"""; expected "OR REPLACE, FORCE, VIEW, MATERIALIZED, ALIAS, SEQUENCE, USER, TRIGGER, ROLE, SCHEMA, CONSTANT, DOMAIN, TYPE, AGGREGATE, LINKED, MEMORY, CACHED, LOCAL TEMPORARY, GLOBAL TEMPORARY, TEMPORARY, TABLE, SYNONYM, UNIQUE, SPATIAL, INDEX"; SQL statement:
CREATE EXTENSION IF NOT EXISTS "uuid-ossp" [42001-240]
Location   : db/migration/V1__1_initial_schema.sql (C:\Users\smedina\Documents\dev\repo\smrsoft\customerservice\target\classes\db\migration\V1__1_initial_schema.sql)
Line       : 3
Statement  : Run Flyway with -X option to see the actual statement causing the problem

	at org.flywaydb.core.internal.command.DbMigrate.doMigrateGroup(DbMigrate.java:399) ~[flyway-core-11.14.1.jar:na]
	at org.flywaydb.core.internal.command.DbMigrate.lambda$applyMigrations$1(DbMigrate.java:283) ~[flyway-core-11.14.1.jar:na]
	at org.flywaydb.core.internal.jdbc.TransactionalExecutionTemplate.execute(TransactionalExecutionTemplate.java:59) ~[flyway-core-11.14.1.jar:na]
	at org.flywaydb.core.internal.command.DbMigrate.applyMigrations(DbMigrate.java:282) ~[flyway-core-11.14.1.jar:na]
	at org.flywaydb.core.internal.command.DbMigrate.migrateGroup(DbMigrate.java:255) ~[flyway-core-11.14.1.jar:na]
	at org.flywaydb.core.internal.command.DbMigrate.lambda$migrateAll$0(DbMigrate.java:153) ~[flyway-core-11.14.1.jar:na]
	at org.flywaydb.core.internal.jdbc.TableLockingExecutionTemplate$1.call(TableLockingExecutionTemplate.java:40) ~[flyway-core-11.14.1.jar:na]
	at org.flywaydb.core.internal.jdbc.TransactionalExecutionTemplate.execute(TransactionalExecutionTemplate.java:59) ~[flyway-core-11.14.1.jar:na]
	at org.flywaydb.core.internal.jdbc.TableLockingExecutionTemplate.execute(TableLockingExecutionTemplate.java:35) ~[flyway-core-11.14.1.jar:na]
	at org.flywaydb.core.internal.database.base.Connection.lock(Connection.java:106) ~[flyway-core-11.14.1.jar:na]
	at org.flywaydb.core.internal.schemahistory.JdbcTableSchemaHistory.lock(JdbcTableSchemaHistory.java:164) ~[flyway-core-11.14.1.jar:na]
	at org.flywaydb.core.internal.command.DbMigrate.migrateAll(DbMigrate.java:153) ~[flyway-core-11.14.1.jar:na]
	at org.flywaydb.core.internal.command.DbMigrate.migrate(DbMigrate.java:104) ~[flyway-core-11.14.1.jar:na]
	at org.flywaydb.core.Flyway.lambda$migrate$3(Flyway.java:245) ~[flyway-core-11.14.1.jar:na]
	at org.flywaydb.core.FlywayExecutor.execute(FlywayExecutor.java:240) ~[flyway-core-11.14.1.jar:na]
	at org.flywaydb.core.Flyway.migrate(Flyway.java:186) ~[flyway-core-11.14.1.jar:na]
	at org.springframework.boot.flyway.autoconfigure.FlywayMigrationInitializer.afterPropertiesSet(FlywayMigrationInitializer.java:67) ~[spring-boot-flyway-4.0.0.jar:4.0.0]
	at org.springframework.beans.factory.support.AbstractAutowireCapableBeanFactory.invokeInitMethods(AbstractAutowireCapableBeanFactory.java:1864) ~[spring-beans-7.0.1.jar:7.0.1]
	at org.springframework.beans.factory.support.AbstractAutowireCapableBeanFactory.initializeBean(AbstractAutowireCapableBeanFactory.java:1813) ~[spring-beans-7.0.1.jar:7.0.1]
	... 108 common frames omitted
Caused by: org.flywaydb.core.internal.sqlscript.FlywaySqlScriptException: Failed to execute script V1__1_initial_schema.sql
-------------------------------------------------
SQL State  : 42001
Error Code : 42001
Message    : Syntax error in SQL statement "CREATE [*]EXTENSION IF NOT EXISTS ""uuid-ossp"""; expected "OR REPLACE, FORCE, VIEW, MATERIALIZED, ALIAS, SEQUENCE, USER, TRIGGER, ROLE, SCHEMA, CONSTANT, DOMAIN, TYPE, AGGREGATE, LINKED, MEMORY, CACHED, LOCAL TEMPORARY, GLOBAL TEMPORARY, TEMPORARY, TABLE, SYNONYM, UNIQUE, SPATIAL, INDEX"; SQL statement:
CREATE EXTENSION IF NOT EXISTS "uuid-ossp" [42001-240]
Location   : db/migration/V1__1_initial_schema.sql (C:\Users\smedina\Documents\dev\repo\smrsoft\customerservice\target\classes\db\migration\V1__1_initial_schema.sql)
Line       : 3
Statement  : Run Flyway with -X option to see the actual statement causing the problem

	at org.flywaydb.core.internal.sqlscript.DefaultSqlScriptExecutor.handleException(DefaultSqlScriptExecutor.java:255) ~[flyway-core-11.14.1.jar:na]
	at org.flywaydb.core.internal.sqlscript.DefaultSqlScriptExecutor.executeStatement(DefaultSqlScriptExecutor.java:216) ~[flyway-core-11.14.1.jar:na]
	at org.flywaydb.core.internal.sqlscript.DefaultSqlScriptExecutor.execute(DefaultSqlScriptExecutor.java:136) ~[flyway-core-11.14.1.jar:na]
	at org.flywaydb.core.internal.resolver.sql.SqlMigrationExecutor.executeOnce(SqlMigrationExecutor.java:75) ~[flyway-core-11.14.1.jar:na]
	at org.flywaydb.core.internal.resolver.sql.SqlMigrationExecutor.lambda$execute$0(SqlMigrationExecutor.java:66) ~[flyway-core-11.14.1.jar:na]
	at org.flywaydb.core.internal.database.DefaultExecutionStrategy.execute(DefaultExecutionStrategy.java:31) ~[flyway-core-11.14.1.jar:na]
	at org.flywaydb.core.internal.resolver.sql.SqlMigrationExecutor.execute(SqlMigrationExecutor.java:65) ~[flyway-core-11.14.1.jar:na]
	at org.flywaydb.core.internal.command.DbMigrate.doMigrateGroup(DbMigrate.java:391) ~[flyway-core-11.14.1.jar:na]
	... 126 common frames omitted
Caused by: org.h2.jdbc.JdbcSQLSyntaxErrorException: Syntax error in SQL statement "CREATE [*]EXTENSION IF NOT EXISTS ""uuid-ossp"""; expected "OR REPLACE, FORCE, VIEW, MATERIALIZED, ALIAS, SEQUENCE, USER, TRIGGER, ROLE, SCHEMA, CONSTANT, DOMAIN, TYPE, AGGREGATE, LINKED, MEMORY, CACHED, LOCAL TEMPORARY, GLOBAL TEMPORARY, TEMPORARY, TABLE, SYNONYM, UNIQUE, SPATIAL, INDEX"; SQL statement:
CREATE EXTENSION IF NOT EXISTS "uuid-ossp" [42001-240]
	at org.h2.message.DbException.getJdbcSQLException(DbException.java:514) ~[h2-2.4.240.jar:2.4.240]
	at org.h2.message.DbException.getJdbcSQLException(DbException.java:489) ~[h2-2.4.240.jar:2.4.240]
	at org.h2.message.DbException.getSyntaxError(DbException.java:261) ~[h2-2.4.240.jar:2.4.240]
	at org.h2.command.ParserBase.getSyntaxError(ParserBase.java:762) ~[h2-2.4.240.jar:2.4.240]
	at org.h2.command.ParserBase.read(ParserBase.java:361) ~[h2-2.4.240.jar:2.4.240]
	at org.h2.command.Parser.parseCreate(Parser.java:6512) ~[h2-2.4.240.jar:2.4.240]
	at org.h2.command.Parser.parsePrepared(Parser.java:648) ~[h2-2.4.240.jar:2.4.240]
	at org.h2.command.Parser.parse(Parser.java:584) ~[h2-2.4.240.jar:2.4.240]
	at org.h2.command.Parser.parse(Parser.java:564) ~[h2-2.4.240.jar:2.4.240]
	at org.h2.command.Parser.prepareCommand(Parser.java:487) ~[h2-2.4.240.jar:2.4.240]
	at org.h2.engine.SessionLocal.prepareLocal(SessionLocal.java:647) ~[h2-2.4.240.jar:2.4.240]
	at org.h2.engine.SessionLocal.prepareCommand(SessionLocal.java:563) ~[h2-2.4.240.jar:2.4.240]
	at org.h2.jdbc.JdbcConnection.prepareCommand(JdbcConnection.java:1160) ~[h2-2.4.240.jar:2.4.240]
	at org.h2.jdbc.JdbcStatement.executeInternal(JdbcStatement.java:245) ~[h2-2.4.240.jar:2.4.240]
	at org.h2.jdbc.JdbcStatement.execute(JdbcStatement.java:231) ~[h2-2.4.240.jar:2.4.240]
	at com.zaxxer.hikari.pool.ProxyStatement.execute(ProxyStatement.java:95) ~[HikariCP-7.0.2.jar:na]
	at com.zaxxer.hikari.pool.HikariProxyStatement.execute(HikariProxyStatement.java) ~[HikariCP-7.0.2.jar:na]
	at org.flywaydb.core.internal.jdbc.JdbcTemplate.executeStatement(JdbcTemplate.java:215) ~[flyway-core-11.14.1.jar:na]
	at org.flywaydb.core.internal.sqlscript.ParsedSqlStatement.execute(ParsedSqlStatement.java:88) ~[flyway-core-11.14.1.jar:na]
	at org.flywaydb.core.internal.sqlscript.DefaultSqlScriptExecutor.executeStatement(DefaultSqlScriptExecutor.java:211) ~[flyway-core-11.14.1.jar:na]
	... 132 common frames omitted

2025-12-15T16:45:39.397-04:00  WARN 9556 --- [customerservice] [           main] o.s.test.context.TestContextManager      : Caught exception while allowing TestExecutionListener [org.springframework.test.context.web.ServletTestExecutionListener] to prepare test instance [com.oriontek.customerservice.CustomerserviceApplicationTests@106459d9]

java.lang.IllegalStateException: Failed to load ApplicationContext for [WebMergedContextConfiguration@4f6fd101 testClass = com.oriontek.customerservice.CustomerserviceApplicationTests, locations = [], classes = [com.oriontek.customerservice.CustomerserviceApplication], contextInitializerClasses = [], activeProfiles = [], propertySourceDescriptors = [], propertySourceProperties = ["org.springframework.boot.test.context.SpringBootTestContextBootstrapper=true"], contextCustomizers = [org.springframework.boot.test.context.PropertyMappingContextCustomizer@0, org.springframework.boot.test.context.filter.ExcludeFilterContextCustomizer@6111ba37, org.springframework.boot.test.json.DuplicateJsonObjectContextCustomizerFactory$DuplicateJsonObjectContextCustomizer@239b0f9d, org.springframework.boot.test.autoconfigure.OnFailureConditionReportContextCustomizerFactory$OnFailureConditionReportContextCustomizer@1eb6749b, org.springframework.test.context.support.DynamicPropertiesContextCustomizer@0, org.springframework.boot.webmvc.test.autoconfigure.WebDriverContextCustomizer@6e1d8f9e, org.springframework.boot.web.server.context.SpringBootTestRandomPortContextCustomizerFactory$Customizer@4f071df8, org.springframework.boot.test.context.SpringBootTestAnnotation@c53382f3], resourceBasePath = "src/main/webapp", contextLoader = org.springframework.boot.test.context.SpringBootContextLoader, parent = null]
	at org.springframework.test.context.cache.DefaultCacheAwareContextLoaderDelegate.lambda$loadContext$0(DefaultCacheAwareContextLoaderDelegate.java:195) ~[spring-test-7.0.1.jar:7.0.1]
	at org.springframework.test.context.cache.DefaultContextCache.put(DefaultContextCache.java:172) ~[spring-test-7.0.1.jar:7.0.1]
	at org.springframework.test.context.cache.DefaultCacheAwareContextLoaderDelegate.loadContext(DefaultCacheAwareContextLoaderDelegate.java:160) ~[spring-test-7.0.1.jar:7.0.1]
	at org.springframework.test.context.support.DefaultTestContext.getApplicationContext(DefaultTestContext.java:128) ~[spring-test-7.0.1.jar:7.0.1]
	at org.springframework.test.context.web.ServletTestExecutionListener.setUpRequestContextIfNecessary(ServletTestExecutionListener.java:200) ~[spring-test-7.0.1.jar:7.0.1]
	at org.springframework.test.context.web.ServletTestExecutionListener.prepareTestInstance(ServletTestExecutionListener.java:139) ~[spring-test-7.0.1.jar:7.0.1]
	at org.springframework.test.context.TestContextManager.prepareTestInstance(TestContextManager.java:260) ~[spring-test-7.0.1.jar:7.0.1]
	at org.springframework.test.context.junit.jupiter.SpringExtension.postProcessTestInstance(SpringExtension.java:203) ~[spring-test-7.0.1.jar:7.0.1]
	at org.junit.jupiter.engine.descriptor.ClassBasedTestDescriptor.lambda$invokeTestInstancePostProcessors$1(ClassBasedTestDescriptor.java:423) ~[junit-jupiter-engine-6.0.1.jar:6.0.1]
	at org.junit.jupiter.engine.descriptor.ClassBasedTestDescriptor.executeAndMaskThrowable(ClassBasedTestDescriptor.java:428) ~[junit-jupiter-engine-6.0.1.jar:6.0.1]
	at org.junit.jupiter.engine.descriptor.ClassBasedTestDescriptor.lambda$invokeTestInstancePostProcessors$0(ClassBasedTestDescriptor.java:422) ~[junit-jupiter-engine-6.0.1.jar:6.0.1]
	at java.base/java.util.stream.ForEachOps$ForEachOp$OfRef.accept(ForEachOps.java:186) ~[na:na]
	at java.base/java.util.stream.ReferencePipeline$3$1.accept(ReferencePipeline.java:215) ~[na:na]
	at java.base/java.util.stream.ReferencePipeline$2$1.accept(ReferencePipeline.java:197) ~[na:na]
	at java.base/java.util.stream.ReferencePipeline$3$1.accept(ReferencePipeline.java:215) ~[na:na]
	at java.base/java.util.ArrayList$ArrayListSpliterator.forEachRemaining(ArrayList.java:1716) ~[na:na]
	at java.base/java.util.stream.AbstractPipeline.copyInto(AbstractPipeline.java:570) ~[na:na]
	at java.base/java.util.stream.AbstractPipeline.wrapAndCopyInto(AbstractPipeline.java:560) ~[na:na]
	at java.base/java.util.stream.ForEachOps$ForEachOp.evaluateSequential(ForEachOps.java:153) ~[na:na]
	at java.base/java.util.stream.ForEachOps$ForEachOp$OfRef.evaluateSequential(ForEachOps.java:176) ~[na:na]
	at java.base/java.util.stream.AbstractPipeline.evaluate(AbstractPipeline.java:265) ~[na:na]
	at java.base/java.util.stream.ReferencePipeline.forEach(ReferencePipeline.java:636) ~[na:na]
	at org.junit.jupiter.engine.descriptor.ClassBasedTestDescriptor.invokeTestInstancePostProcessors(ClassBasedTestDescriptor.java:422) ~[junit-jupiter-engine-6.0.1.jar:6.0.1]
	at org.junit.jupiter.engine.descriptor.ClassBasedTestDescriptor.lambda$instantiateAndPostProcessTestInstance$0(ClassBasedTestDescriptor.java:334) ~[junit-jupiter-engine-6.0.1.jar:6.0.1]
	at org.junit.platform.engine.support.hierarchical.ThrowableCollector.execute(ThrowableCollector.java:74) ~[junit-platform-engine-6.0.1.jar:6.0.1]
	at org.junit.jupiter.engine.descriptor.ClassBasedTestDescriptor.instantiateAndPostProcessTestInstance(ClassBasedTestDescriptor.java:333) ~[junit-jupiter-engine-6.0.1.jar:6.0.1]
	at org.junit.jupiter.engine.descriptor.ClassBasedTestDescriptor.lambda$testInstancesProvider$1(ClassBasedTestDescriptor.java:322) ~[junit-jupiter-engine-6.0.1.jar:6.0.1]
	at java.base/java.util.Optional.orElseGet(Optional.java:364) ~[na:na]
	at org.junit.jupiter.engine.descriptor.ClassBasedTestDescriptor.lambda$testInstancesProvider$0(ClassBasedTestDescriptor.java:321) ~[junit-jupiter-engine-6.0.1.jar:6.0.1]
	at org.junit.jupiter.engine.execution.TestInstancesProvider.getTestInstances(TestInstancesProvider.java:27) ~[junit-jupiter-engine-6.0.1.jar:6.0.1]
	at org.junit.jupiter.engine.descriptor.TestMethodTestDescriptor.lambda$prepare$0(TestMethodTestDescriptor.java:127) ~[junit-jupiter-engine-6.0.1.jar:6.0.1]
	at org.junit.platform.engine.support.hierarchical.ThrowableCollector.execute(ThrowableCollector.java:74) ~[junit-platform-engine-6.0.1.jar:6.0.1]
	at org.junit.jupiter.engine.descriptor.TestMethodTestDescriptor.prepare(TestMethodTestDescriptor.java:126) ~[junit-jupiter-engine-6.0.1.jar:6.0.1]
	at org.junit.jupiter.engine.descriptor.TestMethodTestDescriptor.prepare(TestMethodTestDescriptor.java:70) ~[junit-jupiter-engine-6.0.1.jar:6.0.1]
	at org.junit.platform.engine.support.hierarchical.NodeTestTask.lambda$prepare$0(NodeTestTask.java:144) ~[junit-platform-engine-6.0.1.jar:6.0.1]
	at org.junit.platform.engine.support.hierarchical.ThrowableCollector.execute(ThrowableCollector.java:74) ~[junit-platform-engine-6.0.1.jar:6.0.1]
	at org.junit.platform.engine.support.hierarchical.NodeTestTask.prepare(NodeTestTask.java:144) ~[junit-platform-engine-6.0.1.jar:6.0.1]
	at org.junit.platform.engine.support.hierarchical.NodeTestTask.execute(NodeTestTask.java:110) ~[junit-platform-engine-6.0.1.jar:6.0.1]
	at java.base/java.util.ArrayList.forEach(ArrayList.java:1604) ~[na:na]
	at org.junit.platform.engine.support.hierarchical.SameThreadHierarchicalTestExecutorService.invokeAll(SameThreadHierarchicalTestExecutorService.java:42) ~[junit-platform-engine-6.0.1.jar:6.0.1]
	at org.junit.platform.engine.support.hierarchical.NodeTestTask.lambda$executeRecursively$2(NodeTestTask.java:180) ~[junit-platform-engine-6.0.1.jar:6.0.1]
	at org.junit.platform.engine.support.hierarchical.ThrowableCollector.execute(ThrowableCollector.java:74) ~[junit-platform-engine-6.0.1.jar:6.0.1]
	at org.junit.platform.engine.support.hierarchical.NodeTestTask.lambda$executeRecursively$1(NodeTestTask.java:166) ~[junit-platform-engine-6.0.1.jar:6.0.1]
	at org.junit.platform.engine.support.hierarchical.Node.around(Node.java:138) ~[junit-platform-engine-6.0.1.jar:6.0.1]
	at org.junit.platform.engine.support.hierarchical.NodeTestTask.lambda$executeRecursively$0(NodeTestTask.java:164) ~[junit-platform-engine-6.0.1.jar:6.0.1]
	at org.junit.platform.engine.support.hierarchical.ThrowableCollector.execute(ThrowableCollector.java:74) ~[junit-platform-engine-6.0.1.jar:6.0.1]
	at org.junit.platform.engine.support.hierarchical.NodeTestTask.executeRecursively(NodeTestTask.java:163) ~[junit-platform-engine-6.0.1.jar:6.0.1]
	at org.junit.platform.engine.support.hierarchical.NodeTestTask.execute(NodeTestTask.java:116) ~[junit-platform-engine-6.0.1.jar:6.0.1]
	at java.base/java.util.ArrayList.forEach(ArrayList.java:1604) ~[na:na]
	at org.junit.platform.engine.support.hierarchical.SameThreadHierarchicalTestExecutorService.invokeAll(SameThreadHierarchicalTestExecutorService.java:42) ~[junit-platform-engine-6.0.1.jar:6.0.1]
	at org.junit.platform.engine.support.hierarchical.NodeTestTask.lambda$executeRecursively$2(NodeTestTask.java:180) ~[junit-platform-engine-6.0.1.jar:6.0.1]
	at org.junit.platform.engine.support.hierarchical.ThrowableCollector.execute(ThrowableCollector.java:74) ~[junit-platform-engine-6.0.1.jar:6.0.1]
	at org.junit.platform.engine.support.hierarchical.NodeTestTask.lambda$executeRecursively$1(NodeTestTask.java:166) ~[junit-platform-engine-6.0.1.jar:6.0.1]
	at org.junit.platform.engine.support.hierarchical.Node.around(Node.java:138) ~[junit-platform-engine-6.0.1.jar:6.0.1]
	at org.junit.platform.engine.support.hierarchical.NodeTestTask.lambda$executeRecursively$0(NodeTestTask.java:164) ~[junit-platform-engine-6.0.1.jar:6.0.1]
	at org.junit.platform.engine.support.hierarchical.ThrowableCollector.execute(ThrowableCollector.java:74) ~[junit-platform-engine-6.0.1.jar:6.0.1]
	at org.junit.platform.engine.support.hierarchical.NodeTestTask.executeRecursively(NodeTestTask.java:163) ~[junit-platform-engine-6.0.1.jar:6.0.1]
	at org.junit.platform.engine.support.hierarchical.NodeTestTask.execute(NodeTestTask.java:116) ~[junit-platform-engine-6.0.1.jar:6.0.1]
	at org.junit.platform.engine.support.hierarchical.SameThreadHierarchicalTestExecutorService.submit(SameThreadHierarchicalTestExecutorService.java:36) ~[junit-platform-engine-6.0.1.jar:6.0.1]
	at org.junit.platform.engine.support.hierarchical.HierarchicalTestExecutor.execute(HierarchicalTestExecutor.java:52) ~[junit-platform-engine-6.0.1.jar:6.0.1]
	at org.junit.platform.engine.support.hierarchical.HierarchicalTestEngine.execute(HierarchicalTestEngine.java:58) ~[junit-platform-engine-6.0.1.jar:6.0.1]
	at org.junit.platform.launcher.core.EngineExecutionOrchestrator.executeEngine(EngineExecutionOrchestrator.java:246) ~[junit-platform-launcher-6.0.1.jar:6.0.1]
	at org.junit.platform.launcher.core.EngineExecutionOrchestrator.failOrExecuteEngine(EngineExecutionOrchestrator.java:218) ~[junit-platform-launcher-6.0.1.jar:6.0.1]
	at org.junit.platform.launcher.core.EngineExecutionOrchestrator.execute(EngineExecutionOrchestrator.java:179) ~[junit-platform-launcher-6.0.1.jar:6.0.1]
	at org.junit.platform.launcher.core.EngineExecutionOrchestrator.execute(EngineExecutionOrchestrator.java:108) ~[junit-platform-launcher-6.0.1.jar:6.0.1]
	at org.junit.platform.launcher.core.EngineExecutionOrchestrator.lambda$execute$0(EngineExecutionOrchestrator.java:66) ~[junit-platform-launcher-6.0.1.jar:6.0.1]
	at org.junit.platform.launcher.core.EngineExecutionOrchestrator.withInterceptedStreams(EngineExecutionOrchestrator.java:157) ~[junit-platform-launcher-6.0.1.jar:6.0.1]
	at org.junit.platform.launcher.core.EngineExecutionOrchestrator.execute(EngineExecutionOrchestrator.java:65) ~[junit-platform-launcher-6.0.1.jar:6.0.1]
	at org.junit.platform.launcher.core.DefaultLauncher.execute(DefaultLauncher.java:125) ~[junit-platform-launcher-6.0.1.jar:6.0.1]
	at org.junit.platform.launcher.core.DefaultLauncher.execute(DefaultLauncher.java:114) ~[junit-platform-launcher-6.0.1.jar:6.0.1]
	at org.junit.platform.launcher.core.DelegatingLauncher.execute(DelegatingLauncher.java:58) ~[junit-platform-launcher-6.0.1.jar:6.0.1]
	at org.junit.platform.launcher.core.InterceptingLauncher.lambda$execute$2(InterceptingLauncher.java:57) ~[junit-platform-launcher-6.0.1.jar:6.0.1]
	at org.junit.platform.launcher.core.ClasspathAlignmentCheckingLauncherInterceptor.intercept(ClasspathAlignmentCheckingLauncherInterceptor.java:25) ~[junit-platform-launcher-6.0.1.jar:6.0.1]
	at org.junit.platform.launcher.core.InterceptingLauncher.execute(InterceptingLauncher.java:56) ~[junit-platform-launcher-6.0.1.jar:6.0.1]
	at org.junit.platform.launcher.core.DelegatingLauncher.execute(DelegatingLauncher.java:58) ~[junit-platform-launcher-6.0.1.jar:6.0.1]
	at java.base/jdk.internal.reflect.DirectMethodHandleAccessor.invoke(DirectMethodHandleAccessor.java:104) ~[na:na]
	at java.base/java.lang.reflect.Method.invoke(Method.java:565) ~[na:na]
	at org.apache.maven.surefire.api.util.ReflectionUtils.invokeMethodWithArray(ReflectionUtils.java:125) ~[surefire-api-3.5.4.jar:3.5.4]
	at org.apache.maven.surefire.junitplatform.LauncherAdapter.executeWithCancellationToken(LauncherAdapter.java:68) ~[surefire-junit-platform-3.5.4.jar:3.5.4]
	at org.apache.maven.surefire.junitplatform.LauncherAdapter.execute(LauncherAdapter.java:54) ~[surefire-junit-platform-3.5.4.jar:3.5.4]
	at org.apache.maven.surefire.junitplatform.JUnitPlatformProvider.execute(JUnitPlatformProvider.java:203) ~[surefire-junit-platform-3.5.4.jar:3.5.4]
	at org.apache.maven.surefire.junitplatform.JUnitPlatformProvider.invokeAllTests(JUnitPlatformProvider.java:168) ~[surefire-junit-platform-3.5.4.jar:3.5.4]
	at org.apache.maven.surefire.junitplatform.JUnitPlatformProvider.invoke(JUnitPlatformProvider.java:136) ~[surefire-junit-platform-3.5.4.jar:3.5.4]
	at org.apache.maven.surefire.booter.ForkedBooter.runSuitesInProcess(ForkedBooter.java:385) ~[surefire-booter-3.5.4.jar:3.5.4]
	at org.apache.maven.surefire.booter.ForkedBooter.execute(ForkedBooter.java:162) ~[surefire-booter-3.5.4.jar:3.5.4]
	at org.apache.maven.surefire.booter.ForkedBooter.run(ForkedBooter.java:507) ~[surefire-booter-3.5.4.jar:3.5.4]
	at org.apache.maven.surefire.booter.ForkedBooter.main(ForkedBooter.java:495) ~[surefire-booter-3.5.4.jar:3.5.4]
Caused by: org.springframework.beans.factory.BeanCreationException: Error creating bean with name 'entityManagerFactory' defined in class path resource [org/springframework/boot/hibernate/autoconfigure/HibernateJpaConfiguration.class]: Failed to initialize dependency 'flywayInitializer' of LoadTimeWeaverAware bean 'entityManagerFactory': Error creating bean with name 'flywayInitializer' defined in class path resource [org/springframework/boot/flyway/autoconfigure/FlywayAutoConfiguration$FlywayConfiguration.class]: Failed to execute script V1__1_initial_schema.sql
-------------------------------------------------
SQL State  : 42001
Error Code : 42001
Message    : Syntax error in SQL statement "CREATE [*]EXTENSION IF NOT EXISTS ""uuid-ossp"""; expected "OR REPLACE, FORCE, VIEW, MATERIALIZED, ALIAS, SEQUENCE, USER, TRIGGER, ROLE, SCHEMA, CONSTANT, DOMAIN, TYPE, AGGREGATE, LINKED, MEMORY, CACHED, LOCAL TEMPORARY, GLOBAL TEMPORARY, TEMPORARY, TABLE, SYNONYM, UNIQUE, SPATIAL, INDEX"; SQL statement:
CREATE EXTENSION IF NOT EXISTS "uuid-ossp" [42001-240]
Location   : db/migration/V1__1_initial_schema.sql (C:\Users\smedina\Documents\dev\repo\smrsoft\customerservice\target\classes\db\migration\V1__1_initial_schema.sql)
Line       : 3
Statement  : Run Flyway with -X option to see the actual statement causing the problem

	at org.springframework.beans.factory.support.AbstractBeanFactory.doGetBean(AbstractBeanFactory.java:322) ~[spring-beans-7.0.1.jar:7.0.1]
	at org.springframework.beans.factory.support.AbstractBeanFactory.getBean(AbstractBeanFactory.java:201) ~[spring-beans-7.0.1.jar:7.0.1]
	at org.springframework.context.support.AbstractApplicationContext.finishBeanFactoryInitialization(AbstractApplicationContext.java:966) ~[spring-context-7.0.1.jar:7.0.1]
	at org.springframework.context.support.AbstractApplicationContext.refresh(AbstractApplicationContext.java:620) ~[spring-context-7.0.1.jar:7.0.1]
	at org.springframework.boot.SpringApplication.refresh(SpringApplication.java:765) ~[spring-boot-4.0.0.jar:4.0.0]
	at org.springframework.boot.SpringApplication.refreshContext(SpringApplication.java:454) ~[spring-boot-4.0.0.jar:4.0.0]
	at org.springframework.boot.SpringApplication.run(SpringApplication.java:321) ~[spring-boot-4.0.0.jar:4.0.0]
	at org.springframework.boot.test.context.SpringBootContextLoader.lambda$loadContext$2(SpringBootContextLoader.java:148) ~[spring-boot-test-4.0.0.jar:4.0.0]
	at org.springframework.util.function.ThrowingSupplier.get(ThrowingSupplier.java:58) ~[spring-core-7.0.1.jar:7.0.1]
	at org.springframework.util.function.ThrowingSupplier.get(ThrowingSupplier.java:46) ~[spring-core-7.0.1.jar:7.0.1]
	at org.springframework.boot.SpringApplication.withHook(SpringApplication.java:1474) ~[spring-boot-4.0.0.jar:4.0.0]
	at org.springframework.boot.test.context.SpringBootContextLoader$ContextLoaderHook.run(SpringBootContextLoader.java:573) ~[spring-boot-test-4.0.0.jar:4.0.0]
	at org.springframework.boot.test.context.SpringBootContextLoader.loadContext(SpringBootContextLoader.java:148) ~[spring-boot-test-4.0.0.jar:4.0.0]
	at org.springframework.boot.test.context.SpringBootContextLoader.loadContext(SpringBootContextLoader.java:114) ~[spring-boot-test-4.0.0.jar:4.0.0]
	at org.springframework.test.context.cache.DefaultCacheAwareContextLoaderDelegate.loadContextInternal(DefaultCacheAwareContextLoaderDelegate.java:247) ~[spring-test-7.0.1.jar:7.0.1]
	at org.springframework.test.context.cache.DefaultCacheAwareContextLoaderDelegate.lambda$loadContext$0(DefaultCacheAwareContextLoaderDelegate.java:167) ~[spring-test-7.0.1.jar:7.0.1]
	... 86 common frames omitted
Caused by: org.springframework.beans.factory.BeanCreationException: Error creating bean with name 'flywayInitializer' defined in class path resource [org/springframework/boot/flyway/autoconfigure/FlywayAutoConfiguration$FlywayConfiguration.class]: Failed to execute script V1__1_initial_schema.sql
-------------------------------------------------
SQL State  : 42001
Error Code : 42001
Message    : Syntax error in SQL statement "CREATE [*]EXTENSION IF NOT EXISTS ""uuid-ossp"""; expected "OR REPLACE, FORCE, VIEW, MATERIALIZED, ALIAS, SEQUENCE, USER, TRIGGER, ROLE, SCHEMA, CONSTANT, DOMAIN, TYPE, AGGREGATE, LINKED, MEMORY, CACHED, LOCAL TEMPORARY, GLOBAL TEMPORARY, TEMPORARY, TABLE, SYNONYM, UNIQUE, SPATIAL, INDEX"; SQL statement:
CREATE EXTENSION IF NOT EXISTS "uuid-ossp" [42001-240]
Location   : db/migration/V1__1_initial_schema.sql (C:\Users\smedina\Documents\dev\repo\smrsoft\customerservice\target\classes\db\migration\V1__1_initial_schema.sql)
Line       : 3
Statement  : Run Flyway with -X option to see the actual statement causing the problem

	at org.springframework.beans.factory.support.AbstractAutowireCapableBeanFactory.initializeBean(AbstractAutowireCapableBeanFactory.java:1817) ~[spring-beans-7.0.1.jar:7.0.1]
	at org.springframework.beans.factory.support.AbstractAutowireCapableBeanFactory.doCreateBean(AbstractAutowireCapableBeanFactory.java:603) ~[spring-beans-7.0.1.jar:7.0.1]
	at org.springframework.beans.factory.support.AbstractAutowireCapableBeanFactory.createBean(AbstractAutowireCapableBeanFactory.java:525) ~[spring-beans-7.0.1.jar:7.0.1]
	at org.springframework.beans.factory.support.AbstractBeanFactory.lambda$doGetBean$0(AbstractBeanFactory.java:333) ~[spring-beans-7.0.1.jar:7.0.1]
	at org.springframework.beans.factory.support.DefaultSingletonBeanRegistry.getSingleton(DefaultSingletonBeanRegistry.java:371) ~[spring-beans-7.0.1.jar:7.0.1]
	at org.springframework.beans.factory.support.AbstractBeanFactory.doGetBean(AbstractBeanFactory.java:331) ~[spring-beans-7.0.1.jar:7.0.1]
	at org.springframework.beans.factory.support.AbstractBeanFactory.getBean(AbstractBeanFactory.java:196) ~[spring-beans-7.0.1.jar:7.0.1]
	at org.springframework.beans.factory.support.AbstractBeanFactory.doGetBean(AbstractBeanFactory.java:309) ~[spring-beans-7.0.1.jar:7.0.1]
	... 101 common frames omitted
Caused by: org.flywaydb.core.internal.exception.FlywayMigrateException: Failed to execute script V1__1_initial_schema.sql
-------------------------------------------------
SQL State  : 42001
Error Code : 42001
Message    : Syntax error in SQL statement "CREATE [*]EXTENSION IF NOT EXISTS ""uuid-ossp"""; expected "OR REPLACE, FORCE, VIEW, MATERIALIZED, ALIAS, SEQUENCE, USER, TRIGGER, ROLE, SCHEMA, CONSTANT, DOMAIN, TYPE, AGGREGATE, LINKED, MEMORY, CACHED, LOCAL TEMPORARY, GLOBAL TEMPORARY, TEMPORARY, TABLE, SYNONYM, UNIQUE, SPATIAL, INDEX"; SQL statement:
CREATE EXTENSION IF NOT EXISTS "uuid-ossp" [42001-240]
Location   : db/migration/V1__1_initial_schema.sql (C:\Users\smedina\Documents\dev\repo\smrsoft\customerservice\target\classes\db\migration\V1__1_initial_schema.sql)
Line       : 3
Statement  : Run Flyway with -X option to see the actual statement causing the problem

	at org.flywaydb.core.internal.command.DbMigrate.doMigrateGroup(DbMigrate.java:399) ~[flyway-core-11.14.1.jar:na]
	at org.flywaydb.core.internal.command.DbMigrate.lambda$applyMigrations$1(DbMigrate.java:283) ~[flyway-core-11.14.1.jar:na]
	at org.flywaydb.core.internal.jdbc.TransactionalExecutionTemplate.execute(TransactionalExecutionTemplate.java:59) ~[flyway-core-11.14.1.jar:na]
	at org.flywaydb.core.internal.command.DbMigrate.applyMigrations(DbMigrate.java:282) ~[flyway-core-11.14.1.jar:na]
	at org.flywaydb.core.internal.command.DbMigrate.migrateGroup(DbMigrate.java:255) ~[flyway-core-11.14.1.jar:na]
	at org.flywaydb.core.internal.command.DbMigrate.lambda$migrateAll$0(DbMigrate.java:153) ~[flyway-core-11.14.1.jar:na]
	at org.flywaydb.core.internal.jdbc.TableLockingExecutionTemplate$1.call(TableLockingExecutionTemplate.java:40) ~[flyway-core-11.14.1.jar:na]
	at org.flywaydb.core.internal.jdbc.TransactionalExecutionTemplate.execute(TransactionalExecutionTemplate.java:59) ~[flyway-core-11.14.1.jar:na]
	at org.flywaydb.core.internal.jdbc.TableLockingExecutionTemplate.execute(TableLockingExecutionTemplate.java:35) ~[flyway-core-11.14.1.jar:na]
	at org.flywaydb.core.internal.database.base.Connection.lock(Connection.java:106) ~[flyway-core-11.14.1.jar:na]
	at org.flywaydb.core.internal.schemahistory.JdbcTableSchemaHistory.lock(JdbcTableSchemaHistory.java:164) ~[flyway-core-11.14.1.jar:na]
	at org.flywaydb.core.internal.command.DbMigrate.migrateAll(DbMigrate.java:153) ~[flyway-core-11.14.1.jar:na]
	at org.flywaydb.core.internal.command.DbMigrate.migrate(DbMigrate.java:104) ~[flyway-core-11.14.1.jar:na]
	at org.flywaydb.core.Flyway.lambda$migrate$3(Flyway.java:245) ~[flyway-core-11.14.1.jar:na]
	at org.flywaydb.core.FlywayExecutor.execute(FlywayExecutor.java:240) ~[flyway-core-11.14.1.jar:na]
	at org.flywaydb.core.Flyway.migrate(Flyway.java:186) ~[flyway-core-11.14.1.jar:na]
	at org.springframework.boot.flyway.autoconfigure.FlywayMigrationInitializer.afterPropertiesSet(FlywayMigrationInitializer.java:67) ~[spring-boot-flyway-4.0.0.jar:4.0.0]
	at org.springframework.beans.factory.support.AbstractAutowireCapableBeanFactory.invokeInitMethods(AbstractAutowireCapableBeanFactory.java:1864) ~[spring-beans-7.0.1.jar:7.0.1]
	at org.springframework.beans.factory.support.AbstractAutowireCapableBeanFactory.initializeBean(AbstractAutowireCapableBeanFactory.java:1813) ~[spring-beans-7.0.1.jar:7.0.1]
	... 108 common frames omitted
Caused by: org.flywaydb.core.internal.sqlscript.FlywaySqlScriptException: Failed to execute script V1__1_initial_schema.sql
-------------------------------------------------
SQL State  : 42001
Error Code : 42001
Message    : Syntax error in SQL statement "CREATE [*]EXTENSION IF NOT EXISTS ""uuid-ossp"""; expected "OR REPLACE, FORCE, VIEW, MATERIALIZED, ALIAS, SEQUENCE, USER, TRIGGER, ROLE, SCHEMA, CONSTANT, DOMAIN, TYPE, AGGREGATE, LINKED, MEMORY, CACHED, LOCAL TEMPORARY, GLOBAL TEMPORARY, TEMPORARY, TABLE, SYNONYM, UNIQUE, SPATIAL, INDEX"; SQL statement:
CREATE EXTENSION IF NOT EXISTS "uuid-ossp" [42001-240]
Location   : db/migration/V1__1_initial_schema.sql (C:\Users\smedina\Documents\dev\repo\smrsoft\customerservice\target\classes\db\migration\V1__1_initial_schema.sql)
Line       : 3
Statement  : Run Flyway with -X option to see the actual statement causing the problem

	at org.flywaydb.core.internal.sqlscript.DefaultSqlScriptExecutor.handleException(DefaultSqlScriptExecutor.java:255) ~[flyway-core-11.14.1.jar:na]
	at org.flywaydb.core.internal.sqlscript.DefaultSqlScriptExecutor.executeStatement(DefaultSqlScriptExecutor.java:216) ~[flyway-core-11.14.1.jar:na]
	at org.flywaydb.core.internal.sqlscript.DefaultSqlScriptExecutor.execute(DefaultSqlScriptExecutor.java:136) ~[flyway-core-11.14.1.jar:na]
	at org.flywaydb.core.internal.resolver.sql.SqlMigrationExecutor.executeOnce(SqlMigrationExecutor.java:75) ~[flyway-core-11.14.1.jar:na]
	at org.flywaydb.core.internal.resolver.sql.SqlMigrationExecutor.lambda$execute$0(SqlMigrationExecutor.java:66) ~[flyway-core-11.14.1.jar:na]
	at org.flywaydb.core.internal.database.DefaultExecutionStrategy.execute(DefaultExecutionStrategy.java:31) ~[flyway-core-11.14.1.jar:na]
	at org.flywaydb.core.internal.resolver.sql.SqlMigrationExecutor.execute(SqlMigrationExecutor.java:65) ~[flyway-core-11.14.1.jar:na]
	at org.flywaydb.core.internal.command.DbMigrate.doMigrateGroup(DbMigrate.java:391) ~[flyway-core-11.14.1.jar:na]
	... 126 common frames omitted
Caused by: org.h2.jdbc.JdbcSQLSyntaxErrorException: Syntax error in SQL statement "CREATE [*]EXTENSION IF NOT EXISTS ""uuid-ossp"""; expected "OR REPLACE, FORCE, VIEW, MATERIALIZED, ALIAS, SEQUENCE, USER, TRIGGER, ROLE, SCHEMA, CONSTANT, DOMAIN, TYPE, AGGREGATE, LINKED, MEMORY, CACHED, LOCAL TEMPORARY, GLOBAL TEMPORARY, TEMPORARY, TABLE, SYNONYM, UNIQUE, SPATIAL, INDEX"; SQL statement:
CREATE EXTENSION IF NOT EXISTS "uuid-ossp" [42001-240]
	at org.h2.message.DbException.getJdbcSQLException(DbException.java:514) ~[h2-2.4.240.jar:2.4.240]
	at org.h2.message.DbException.getJdbcSQLException(DbException.java:489) ~[h2-2.4.240.jar:2.4.240]
	at org.h2.message.DbException.getSyntaxError(DbException.java:261) ~[h2-2.4.240.jar:2.4.240]
	at org.h2.command.ParserBase.getSyntaxError(ParserBase.java:762) ~[h2-2.4.240.jar:2.4.240]
	at org.h2.command.ParserBase.read(ParserBase.java:361) ~[h2-2.4.240.jar:2.4.240]
	at org.h2.command.Parser.parseCreate(Parser.java:6512) ~[h2-2.4.240.jar:2.4.240]
	at org.h2.command.Parser.parsePrepared(Parser.java:648) ~[h2-2.4.240.jar:2.4.240]
	at org.h2.command.Parser.parse(Parser.java:584) ~[h2-2.4.240.jar:2.4.240]
	at org.h2.command.Parser.parse(Parser.java:564) ~[h2-2.4.240.jar:2.4.240]
	at org.h2.command.Parser.prepareCommand(Parser.java:487) ~[h2-2.4.240.jar:2.4.240]
	at org.h2.engine.SessionLocal.prepareLocal(SessionLocal.java:647) ~[h2-2.4.240.jar:2.4.240]
	at org.h2.engine.SessionLocal.prepareCommand(SessionLocal.java:563) ~[h2-2.4.240.jar:2.4.240]
	at org.h2.jdbc.JdbcConnection.prepareCommand(JdbcConnection.java:1160) ~[h2-2.4.240.jar:2.4.240]
	at org.h2.jdbc.JdbcStatement.executeInternal(JdbcStatement.java:245) ~[h2-2.4.240.jar:2.4.240]
	at org.h2.jdbc.JdbcStatement.execute(JdbcStatement.java:231) ~[h2-2.4.240.jar:2.4.240]
	at com.zaxxer.hikari.pool.ProxyStatement.execute(ProxyStatement.java:95) ~[HikariCP-7.0.2.jar:na]
	at com.zaxxer.hikari.pool.HikariProxyStatement.execute(HikariProxyStatement.java) ~[HikariCP-7.0.2.jar:na]
	at org.flywaydb.core.internal.jdbc.JdbcTemplate.executeStatement(JdbcTemplate.java:215) ~[flyway-core-11.14.1.jar:na]
	at org.flywaydb.core.internal.sqlscript.ParsedSqlStatement.execute(ParsedSqlStatement.java:88) ~[flyway-core-11.14.1.jar:na]
	at org.flywaydb.core.internal.sqlscript.DefaultSqlScriptExecutor.executeStatement(DefaultSqlScriptExecutor.java:211) ~[flyway-core-11.14.1.jar:na]
	... 132 common frames omitted

[ERROR] Tests run: 1, Failures: 0, Errors: 1, Skipped: 0, Time elapsed: 7.573 s <<< FAILURE! -- in com.oriontek.customerservice.CustomerserviceApplicationTests
[ERROR] com.oriontek.customerservice.CustomerserviceApplicationTests.contextLoads -- Time elapsed: 0.057 s <<< ERROR!
java.lang.IllegalStateException: Failed to load ApplicationContext for [WebMergedContextConfiguration@4f6fd101 testClass = com.oriontek.customerservice.CustomerserviceApplicationTests, locations = [], classes = [com.oriontek.customerservice.CustomerserviceApplication], contextInitializerClasses = [], activeProfiles = [], propertySourceDescriptors = [], propertySourceProperties = ["org.springframework.boot.test.context.SpringBootTestContextBootstrapper=true"], contextCustomizers = [org.springframework.boot.test.context.PropertyMappingContextCustomizer@0, org.springframework.boot.test.context.filter.ExcludeFilterContextCustomizer@6111ba37, org.springframework.boot.test.json.DuplicateJsonObjectContextCustomizerFactory$DuplicateJsonObjectContextCustomizer@239b0f9d, org.springframework.boot.test.autoconfigure.OnFailureConditionReportContextCustomizerFactory$OnFailureConditionReportContextCustomizer@1eb6749b, org.springframework.test.context.support.DynamicPropertiesContextCustomizer@0, org.springframework.boot.webmvc.test.autoconfigure.WebDriverContextCustomizer@6e1d8f9e, org.springframework.boot.web.server.context.SpringBootTestRandomPortContextCustomizerFactory$Customizer@4f071df8, org.springframework.boot.test.context.SpringBootTestAnnotation@c53382f3], resourceBasePath = "src/main/webapp", contextLoader = org.springframework.boot.test.context.SpringBootContextLoader, parent = null]
	at org.springframework.test.context.cache.DefaultCacheAwareContextLoaderDelegate.lambda$loadContext$0(DefaultCacheAwareContextLoaderDelegate.java:195)
	at org.springframework.test.context.cache.DefaultContextCache.put(DefaultContextCache.java:172)
	at org.springframework.test.context.cache.DefaultCacheAwareContextLoaderDelegate.loadContext(DefaultCacheAwareContextLoaderDelegate.java:160)
	at org.springframework.test.context.support.DefaultTestContext.getApplicationContext(DefaultTestContext.java:128)
	at org.springframework.test.context.web.ServletTestExecutionListener.setUpRequestContextIfNecessary(ServletTestExecutionListener.java:200)
	at org.springframework.test.context.web.ServletTestExecutionListener.prepareTestInstance(ServletTestExecutionListener.java:139)
	at org.springframework.test.context.TestContextManager.prepareTestInstance(TestContextManager.java:260)
	at org.springframework.test.context.junit.jupiter.SpringExtension.postProcessTestInstance(SpringExtension.java:203)
	at java.base/java.util.stream.ForEachOps$ForEachOp$OfRef.accept(ForEachOps.java:186)
	at java.base/java.util.stream.ReferencePipeline$3$1.accept(ReferencePipeline.java:215)
	at java.base/java.util.stream.ReferencePipeline$2$1.accept(ReferencePipeline.java:197)
	at java.base/java.util.stream.ReferencePipeline$3$1.accept(ReferencePipeline.java:215)
	at java.base/java.util.ArrayList$ArrayListSpliterator.forEachRemaining(ArrayList.java:1716)
	at java.base/java.util.stream.AbstractPipeline.copyInto(AbstractPipeline.java:570)
	at java.base/java.util.stream.AbstractPipeline.wrapAndCopyInto(AbstractPipeline.java:560)
	at java.base/java.util.stream.ForEachOps$ForEachOp.evaluateSequential(ForEachOps.java:153)
	at java.base/java.util.stream.ForEachOps$ForEachOp$OfRef.evaluateSequential(ForEachOps.java:176)
	at java.base/java.util.stream.AbstractPipeline.evaluate(AbstractPipeline.java:265)
	at java.base/java.util.stream.ReferencePipeline.forEach(ReferencePipeline.java:636)
	at java.base/java.util.Optional.orElseGet(Optional.java:364)
	at java.base/java.util.ArrayList.forEach(ArrayList.java:1604)
	at java.base/java.util.ArrayList.forEach(ArrayList.java:1604)
Caused by: org.springframework.beans.factory.BeanCreationException: Error creating bean with name 'entityManagerFactory' defined in class path resource [org/springframework/boot/hibernate/autoconfigure/HibernateJpaConfiguration.class]: Failed to initialize dependency 'flywayInitializer' of LoadTimeWeaverAware bean 'entityManagerFactory': Error creating bean with name 'flywayInitializer' defined in class path resource [org/springframework/boot/flyway/autoconfigure/FlywayAutoConfiguration$FlywayConfiguration.class]: Failed to execute script V1__1_initial_schema.sql
-------------------------------------------------
SQL State  : 42001
Error Code : 42001
Message    : Syntax error in SQL statement "CREATE [*]EXTENSION IF NOT EXISTS ""uuid-ossp"""; expected "OR REPLACE, FORCE, VIEW, MATERIALIZED, ALIAS, SEQUENCE, USER, TRIGGER, ROLE, SCHEMA, CONSTANT, DOMAIN, TYPE, AGGREGATE, LINKED, MEMORY, CACHED, LOCAL TEMPORARY, GLOBAL TEMPORARY, TEMPORARY, TABLE, SYNONYM, UNIQUE, SPATIAL, INDEX"; SQL statement:
CREATE EXTENSION IF NOT EXISTS "uuid-ossp" [42001-240]
Location   : db/migration/V1__1_initial_schema.sql (C:\Users\smedina\Documents\dev\repo\smrsoft\customerservice\target\classes\db\migration\V1__1_initial_schema.sql)
Line       : 3
Statement  : Run Flyway with -X option to see the actual statement causing the problem

	at org.springframework.beans.factory.support.AbstractBeanFactory.doGetBean(AbstractBeanFactory.java:322)
	at org.springframework.beans.factory.support.AbstractBeanFactory.getBean(AbstractBeanFactory.java:201)
	at org.springframework.context.support.AbstractApplicationContext.finishBeanFactoryInitialization(AbstractApplicationContext.java:966)
	at org.springframework.context.support.AbstractApplicationContext.refresh(AbstractApplicationContext.java:620)
	at org.springframework.boot.SpringApplication.refresh(SpringApplication.java:765)
	at org.springframework.boot.SpringApplication.refreshContext(SpringApplication.java:454)
	at org.springframework.boot.SpringApplication.run(SpringApplication.java:321)
	at org.springframework.boot.test.context.SpringBootContextLoader.lambda$loadContext$2(SpringBootContextLoader.java:148)
	at org.springframework.util.function.ThrowingSupplier.get(ThrowingSupplier.java:58)
	at org.springframework.util.function.ThrowingSupplier.get(ThrowingSupplier.java:46)
	at org.springframework.boot.SpringApplication.withHook(SpringApplication.java:1474)
	at org.springframework.boot.test.context.SpringBootContextLoader$ContextLoaderHook.run(SpringBootContextLoader.java:573)
	at org.springframework.boot.test.context.SpringBootContextLoader.loadContext(SpringBootContextLoader.java:148)
	at org.springframework.boot.test.context.SpringBootContextLoader.loadContext(SpringBootContextLoader.java:114)
	at org.springframework.test.context.cache.DefaultCacheAwareContextLoaderDelegate.loadContextInternal(DefaultCacheAwareContextLoaderDelegate.java:247)
	at org.springframework.test.context.cache.DefaultCacheAwareContextLoaderDelegate.lambda$loadContext$0(DefaultCacheAwareContextLoaderDelegate.java:167)
	... 21 more
Caused by: org.springframework.beans.factory.BeanCreationException: Error creating bean with name 'flywayInitializer' defined in class path resource [org/springframework/boot/flyway/autoconfigure/FlywayAutoConfiguration$FlywayConfiguration.class]: Failed to execute script V1__1_initial_schema.sql
-------------------------------------------------
SQL State  : 42001
Error Code : 42001
Message    : Syntax error in SQL statement "CREATE [*]EXTENSION IF NOT EXISTS ""uuid-ossp"""; expected "OR REPLACE, FORCE, VIEW, MATERIALIZED, ALIAS, SEQUENCE, USER, TRIGGER, ROLE, SCHEMA, CONSTANT, DOMAIN, TYPE, AGGREGATE, LINKED, MEMORY, CACHED, LOCAL TEMPORARY, GLOBAL TEMPORARY, TEMPORARY, TABLE, SYNONYM, UNIQUE, SPATIAL, INDEX"; SQL statement:
CREATE EXTENSION IF NOT EXISTS "uuid-ossp" [42001-240]
Location   : db/migration/V1__1_initial_schema.sql (C:\Users\smedina\Documents\dev\repo\smrsoft\customerservice\target\classes\db\migration\V1__1_initial_schema.sql)
Line       : 3
Statement  : Run Flyway with -X option to see the actual statement causing the problem

	at org.springframework.beans.factory.support.AbstractAutowireCapableBeanFactory.initializeBean(AbstractAutowireCapableBeanFactory.java:1817)
	at org.springframework.beans.factory.support.AbstractAutowireCapableBeanFactory.doCreateBean(AbstractAutowireCapableBeanFactory.java:603)
	at org.springframework.beans.factory.support.AbstractAutowireCapableBeanFactory.createBean(AbstractAutowireCapableBeanFactory.java:525)
	at org.springframework.beans.factory.support.AbstractBeanFactory.lambda$doGetBean$0(AbstractBeanFactory.java:333)
	at org.springframework.beans.factory.support.DefaultSingletonBeanRegistry.getSingleton(DefaultSingletonBeanRegistry.java:371)
	at org.springframework.beans.factory.support.AbstractBeanFactory.doGetBean(AbstractBeanFactory.java:331)
	at org.springframework.beans.factory.support.AbstractBeanFactory.getBean(AbstractBeanFactory.java:196)
	at org.springframework.beans.factory.support.AbstractBeanFactory.doGetBean(AbstractBeanFactory.java:309)
	... 36 more
Caused by: org.flywaydb.core.internal.exception.FlywayMigrateException: Failed to execute script V1__1_initial_schema.sql
-------------------------------------------------
SQL State  : 42001
Error Code : 42001
Message    : Syntax error in SQL statement "CREATE [*]EXTENSION IF NOT EXISTS ""uuid-ossp"""; expected "OR REPLACE, FORCE, VIEW, MATERIALIZED, ALIAS, SEQUENCE, USER, TRIGGER, ROLE, SCHEMA, CONSTANT, DOMAIN, TYPE, AGGREGATE, LINKED, MEMORY, CACHED, LOCAL TEMPORARY, GLOBAL TEMPORARY, TEMPORARY, TABLE, SYNONYM, UNIQUE, SPATIAL, INDEX"; SQL statement:
CREATE EXTENSION IF NOT EXISTS "uuid-ossp" [42001-240]
Location   : db/migration/V1__1_initial_schema.sql (C:\Users\smedina\Documents\dev\repo\smrsoft\customerservice\target\classes\db\migration\V1__1_initial_schema.sql)
Line       : 3
Statement  : Run Flyway with -X option to see the actual statement causing the problem

	at org.flywaydb.core.internal.command.DbMigrate.doMigrateGroup(DbMigrate.java:399)
	at org.flywaydb.core.internal.command.DbMigrate.lambda$applyMigrations$1(DbMigrate.java:283)
	at org.flywaydb.core.internal.jdbc.TransactionalExecutionTemplate.execute(TransactionalExecutionTemplate.java:59)
	at org.flywaydb.core.internal.command.DbMigrate.applyMigrations(DbMigrate.java:282)
	at org.flywaydb.core.internal.command.DbMigrate.migrateGroup(DbMigrate.java:255)
	at org.flywaydb.core.internal.command.DbMigrate.lambda$migrateAll$0(DbMigrate.java:153)
	at org.flywaydb.core.internal.jdbc.TableLockingExecutionTemplate$1.call(TableLockingExecutionTemplate.java:40)
	at org.flywaydb.core.internal.jdbc.TransactionalExecutionTemplate.execute(TransactionalExecutionTemplate.java:59)
	at org.flywaydb.core.internal.jdbc.TableLockingExecutionTemplate.execute(TableLockingExecutionTemplate.java:35)
	at org.flywaydb.core.internal.database.base.Connection.lock(Connection.java:106)
	at org.flywaydb.core.internal.schemahistory.JdbcTableSchemaHistory.lock(JdbcTableSchemaHistory.java:164)
	at org.flywaydb.core.internal.command.DbMigrate.migrateAll(DbMigrate.java:153)
	at org.flywaydb.core.internal.command.DbMigrate.migrate(DbMigrate.java:104)
	at org.flywaydb.core.Flyway.lambda$migrate$3(Flyway.java:245)
	at org.flywaydb.core.FlywayExecutor.execute(FlywayExecutor.java:240)
	at org.flywaydb.core.Flyway.migrate(Flyway.java:186)
	at org.springframework.boot.flyway.autoconfigure.FlywayMigrationInitializer.afterPropertiesSet(FlywayMigrationInitializer.java:67)
	at org.springframework.beans.factory.support.AbstractAutowireCapableBeanFactory.invokeInitMethods(AbstractAutowireCapableBeanFactory.java:1864)
	at org.springframework.beans.factory.support.AbstractAutowireCapableBeanFactory.initializeBean(AbstractAutowireCapableBeanFactory.java:1813)
	... 43 more
Caused by: org.flywaydb.core.internal.sqlscript.FlywaySqlScriptException: Failed to execute script V1__1_initial_schema.sql
-------------------------------------------------
SQL State  : 42001
Error Code : 42001
Message    : Syntax error in SQL statement "CREATE [*]EXTENSION IF NOT EXISTS ""uuid-ossp"""; expected "OR REPLACE, FORCE, VIEW, MATERIALIZED, ALIAS, SEQUENCE, USER, TRIGGER, ROLE, SCHEMA, CONSTANT, DOMAIN, TYPE, AGGREGATE, LINKED, MEMORY, CACHED, LOCAL TEMPORARY, GLOBAL TEMPORARY, TEMPORARY, TABLE, SYNONYM, UNIQUE, SPATIAL, INDEX"; SQL statement:
CREATE EXTENSION IF NOT EXISTS "uuid-ossp" [42001-240]
Location   : db/migration/V1__1_initial_schema.sql (C:\Users\smedina\Documents\dev\repo\smrsoft\customerservice\target\classes\db\migration\V1__1_initial_schema.sql)
Line       : 3
Statement  : Run Flyway with -X option to see the actual statement causing the problem

	at org.flywaydb.core.internal.sqlscript.DefaultSqlScriptExecutor.handleException(DefaultSqlScriptExecutor.java:255)
	at org.flywaydb.core.internal.sqlscript.DefaultSqlScriptExecutor.executeStatement(DefaultSqlScriptExecutor.java:216)
	at org.flywaydb.core.internal.sqlscript.DefaultSqlScriptExecutor.execute(DefaultSqlScriptExecutor.java:136)
	at org.flywaydb.core.internal.resolver.sql.SqlMigrationExecutor.executeOnce(SqlMigrationExecutor.java:75)
	at org.flywaydb.core.internal.resolver.sql.SqlMigrationExecutor.lambda$execute$0(SqlMigrationExecutor.java:66)
	at org.flywaydb.core.internal.database.DefaultExecutionStrategy.execute(DefaultExecutionStrategy.java:31)
	at org.flywaydb.core.internal.resolver.sql.SqlMigrationExecutor.execute(SqlMigrationExecutor.java:65)
	at org.flywaydb.core.internal.command.DbMigrate.doMigrateGroup(DbMigrate.java:391)
	... 61 more
Caused by: org.h2.jdbc.JdbcSQLSyntaxErrorException: Syntax error in SQL statement "CREATE [*]EXTENSION IF NOT EXISTS ""uuid-ossp"""; expected "OR REPLACE, FORCE, VIEW, MATERIALIZED, ALIAS, SEQUENCE, USER, TRIGGER, ROLE, SCHEMA, CONSTANT, DOMAIN, TYPE, AGGREGATE, LINKED, MEMORY, CACHED, LOCAL TEMPORARY, GLOBAL TEMPORARY, TEMPORARY, TABLE, SYNONYM, UNIQUE, SPATIAL, INDEX"; SQL statement:
CREATE EXTENSION IF NOT EXISTS "uuid-ossp" [42001-240]
	at org.h2.message.DbException.getJdbcSQLException(DbException.java:514)
	at org.h2.message.DbException.getJdbcSQLException(DbException.java:489)
	at org.h2.message.DbException.getSyntaxError(DbException.java:261)
	at org.h2.command.ParserBase.getSyntaxError(ParserBase.java:762)
	at org.h2.command.ParserBase.read(ParserBase.java:361)
	at org.h2.command.Parser.parseCreate(Parser.java:6512)
	at org.h2.command.Parser.parsePrepared(Parser.java:648)
	at org.h2.command.Parser.parse(Parser.java:584)
	at org.h2.command.Parser.parse(Parser.java:564)
	at org.h2.command.Parser.prepareCommand(Parser.java:487)
	at org.h2.engine.SessionLocal.prepareLocal(SessionLocal.java:647)
	at org.h2.engine.SessionLocal.prepareCommand(SessionLocal.java:563)
	at org.h2.jdbc.JdbcConnection.prepareCommand(JdbcConnection.java:1160)
	at org.h2.jdbc.JdbcStatement.executeInternal(JdbcStatement.java:245)
	at org.h2.jdbc.JdbcStatement.execute(JdbcStatement.java:231)
	at com.zaxxer.hikari.pool.ProxyStatement.execute(ProxyStatement.java:95)
	at com.zaxxer.hikari.pool.HikariProxyStatement.execute(HikariProxyStatement.java)
	at org.flywaydb.core.internal.jdbc.JdbcTemplate.executeStatement(JdbcTemplate.java:215)
	at org.flywaydb.core.internal.sqlscript.ParsedSqlStatement.execute(ParsedSqlStatement.java:88)
	at org.flywaydb.core.internal.sqlscript.DefaultSqlScriptExecutor.executeStatement(DefaultSqlScriptExecutor.java:211)
	... 67 more

[INFO] 
[INFO] Results:
[INFO] 
[ERROR] Errors: 
[ERROR]   CustomerserviceApplicationTests.contextLoads  IllegalState Failed to load ApplicationContext for [WebMergedContextConfiguration@4f6fd101 testClass = com.oriontek.customerservice.CustomerserviceApplicationTests, locations = [], classes = [com.oriontek.customerservice.CustomerserviceApplication], contextInitializerClasses = [], activeProfiles = [], propertySourceDescriptors = [], propertySourceProperties = ["org.springframework.boot.test.context.SpringBootTestContextBootstrapper=true"], contextCustomizers = [org.springframework.boot.test.context.PropertyMappingContextCustomizer@0, org.springframework.boot.test.context.filter.ExcludeFilterContextCustomizer@6111ba37, org.springframework.boot.test.json.DuplicateJsonObjectContextCustomizerFactory$DuplicateJsonObjectContextCustomizer@239b0f9d, org.springframework.boot.test.autoconfigure.OnFailureConditionReportContextCustomizerFactory$OnFailureConditionReportContextCustomizer@1eb6749b, org.springframework.test.context.support.DynamicPropertiesContextCustomizer@0, org.springframework.boot.webmvc.test.autoconfigure.WebDriverContextCustomizer@6e1d8f9e, org.springframework.boot.web.server.context.SpringBootTestRandomPortContextCustomizerFactory$Customizer@4f071df8, org.springframework.boot.test.context.SpringBootTestAnnotation@c53382f3], resourceBasePath = "src/main/webapp", contextLoader = org.springframework.boot.test.context.SpringBootContextLoader, parent = null]
[INFO] 
[ERROR] Tests run: 1, Failures: 0, Errors: 1, Skipped: 0
[INFO] 
[INFO] ------------------------------------------------------------------------
[INFO] BUILD FAILURE
[INFO] ------------------------------------------------------------------------
[INFO] Total time:  20.332 s
[INFO] Finished at: 2025-12-15T16:45:40-04:00
[INFO] ------------------------------------------------------------------------
[ERROR] Failed to execute goal org.apache.maven.plugins:maven-surefire-plugin:3.5.4:test (default-test) on project customerservice: 
[ERROR] 
[ERROR] See C:\Users\smedina\Documents\dev\repo\smrsoft\customerservice\target\surefire-reports for the individual test results.
[ERROR] See dump files (if any exist) [date].dump, [date]-jvmRun[N].dump and [date].dumpstream.
[ERROR] -> [Help 1]
[ERROR] 
[ERROR] To see the full stack trace of the errors, re-run Maven with the -e switch.
[ERROR] Re-run Maven using the -X switch to enable full debug logging.
[ERROR] 
[ERROR] For more information about the errors and possible solutions, please read the following articles:
[ERROR] [Help 1] http://cwiki.apache.org/confluence/display/MAVEN/MojoFailureException
